{
  "key": "112:1-4",
  "surah": 112,
  "start": 1,
  "end": 4,
  "theme": "Sincerity",
  "themeId": "sincerity",
  "title": "The Whole Doctrine In Four Lines",
  "tier": "discover",
  "meaning": "Four short lines answer a direct question about who God is, and the answer is given by subtraction. God is one, not one of a series. He is the one everything turns to and who turns to nothing. He has no parent and no child, so no lineage places Him inside creation. Nothing stands beside Him as an equal. The commentators read the surah as a definition offered in the negative, because every positive comparison would already be false.",
  "historicalContext": "Meccan, from the early years of the mission, when the Prophet Muhammad (peace be upon him) was pressed by the city's leaders to describe his God in the terms they used for theirs. The classical sources report that questioners asked him to name God's ancestry and material, expecting a genealogy of the kind attached to the idols around the Kaaba. The surah refuses the frame entirely rather than answering inside it.",
  "keyTerms": [
    {
      "arabic": "أَحَد",
      "gloss": "one, uniquely one",
      "note": "Not the ordinary counting word for one. It carries uniqueness rather than quantity, so it denies that God belongs to any category that could hold a second member alongside Him."
    },
    {
      "arabic": "ٱلصَّمَد",
      "gloss": "the Eternal Refuge",
      "note": "A word with no clean English equivalent. The root suggests something solid and without hollow, and the classical readings include the one everything depends on and the one who depends on nothing at all."
    },
    {
      "arabic": "كُفُوًا",
      "gloss": "equal, comparable",
      "note": "Used of a marriage match or a social equal, someone of the same standing. Denying any such match rules out partners, rivals, and companions of the same order of being."
    }
  ],
  "lifeInProphetsTime": "Mecca ran on lineage. A man was placed by his father, his clan, and the alliances his grandfather made, and the gods of the sanctuary were placed the same way, with parents, daughters, and family quarrels of their own. To ask about ancestry was the ordinary way of asking who someone was. A being with no lineage at all was not a modest claim in that city; it was a refusal of the whole system of placement.",
  "didYouKnow": "The Prophet is reported to have said this surah equals a third of the Quran, and the classical commentators explain the arithmetic rather than the miracle: the Quran's subject matter divides into law, narrative, and the description of God, and these four lines cover the last of the three entirely on their own. It is among the first surahs most children memorise.",
  "theologicalSignificance": "This is the shortest complete statement of monotheism in the Quran, and it works by clearing ground rather than by building. Every clause removes something: plurality, dependence, ancestry, offspring, comparison. What remains cannot be pictured, which is the point. Later theology across the tradition took these four lines as the boundary marker for any statement about God, and any description that would place Him inside creation fails the test set here.",
  "crossReferences": [
    { "ref": "42:11", "why": "States the same denial of comparison directly: nothing resembles Him, while He hears and sees." },
    { "ref": "2:255", "why": "Expands the same oneness into God's sustaining of the heavens and the earth without fatigue." },
    { "ref": "6:101", "why": "Argues the denial of offspring from the absence of any consort, in the same negative style." }
  ],
  "applyIt": "Notice today how often you describe God by comparison, even silently: as a bigger version of a parent, a judge, a distant employer. Catch one of those pictures as it forms and set it down without replacing it with another. The surah is asking you to hold an idea you cannot illustrate, and that discomfort is the lesson rather than a failure of yours.",
  "exploreFurther": ["42:11", "6:101", "59:22-24"],
  "meta": {
    "model": "claude-opus-5",
    "promptVersion": "p1",
    "generatedAt": "2026-09-09T00:00:00.000Z",
    "reviewed": false
  }
}
