{
  "key": "112:1-4",
  "surah": 112,
  "start": 1,
  "end": 4,
  "theme": "Sincerity",
  "themeId": "sincerity",
  "title": "Four Lines Of Denial",
  "tier": "discover",
  "meaning": "Four lines, and each one takes something away. God is one, in a word Arabic uses for nothing else here. He is the one everyone turns to, and He needs nothing. He did not father anyone, and no one fathered Him. That closes both directions of descent. And nothing is equal to Him. The surah never says what God is like. The early scholars treat that silence as its method.",
  "historicalContext": "Meccan. The sources say people asked the Prophet Muhammad (peace be upon him) to describe his Lord. They wanted to know what He was made of and who His ancestors were. This surah was the answer. The reports differ over who asked. Arabia's gods had family lines and home ground. So a question about lineage was the first one anyone would put.",
  "keyTerms": [
    {
      "arabic": "أَحَدٌ",
      "gloss": "one, a single one",
      "note": "Not the ordinary word for the number one. Arabic uses it in negative sentences to mean not anyone at all. Used here in a positive one, it says a oneness with no second of any kind."
    },
    {
      "arabic": "ٱلصَّمَدُ",
      "gloss": "the eternally sought, self-sufficient",
      "note": "The root means to head toward a thing, and also to be solid with nothing hollow inside. Early scholars keep both: the one everyone turns to in need, and the one with nothing empty in Him."
    },
    {
      "arabic": "كُفُوًا",
      "gloss": "an equal, a match",
      "note": "The word for a marriage partner of matching standing, and for anything of equal worth. Denying it removes rivals and peers alike. No scale is left on which to make the comparison."
    }
  ],
  "lifeInProphetsTime": "Arabian gods were family. The three named in another surah were called daughters of a higher god. Shrines passed from father to son, and a god belonged to one place and one people. Asking about a god's parents was not rude. It was how you found out whose god it was. The third line answers by refusing the whole idea.",
  "didYouKnow": "The early collections keep a report that this surah is worth a third of the Quran. Another says a man repeated it all night, and was told his love for it would bring him into the garden. It is four short lines. The old explanation of the sum is that the Quran's subject matter falls into three parts, and this is one of them.",
  "theologicalSignificance": "Describing God by denial stops the description turning into a picture. That is the surah's whole method. Any positive image a person forms is borrowed from something made. Each line here removes one such image before it can settle. What is left cannot be pictured, and a child can still recite it. So it became the shortest full answer in the tradition.",
  "crossReferences": [
    {
      "ref": "42:11",
      "why": "Denies any likeness in the same way, then hangs two attributes on that denial in one line."
    },
    {
      "ref": "2:255",
      "why": "Uses the same method at greater length, saying what God is not rather than drawing a picture."
    },
    {
      "ref": "19:88-93",
      "why": "Answers the same claim about descent at length, with the heavens near to splitting at it."
    }
  ],
  "applyIt": "Say these four lines once. Then notice what picture your mind supplied anyway. Everyone supplies one: a light, a direction, a presence somewhere above. Do not fight it. The surah works by removing pictures one at a time. You cannot remove a picture you have not caught yourself making.",
  "exploreFurther": [
    "42:11",
    "2:255",
    "19:88-95"
  ],
  "explainEasier": "God is one. He is not made of anything. He has no father and no children. No one is like him at all. Everyone needs him for what they need, and he needs no one.",
  "meta": {
    "model": "claude-opus-5",
    "promptVersion": "p1",
    "generatedAt": "2026-09-09T00:00:00.000Z",
    "reviewed": false,
    "simplified": "p1",
    "author": "opus-session"
  }
}
